{
  "adapter": {
    "manifest_document": "adapter-manifest.json"
  },
  "contract": "simulation.conformance_export",
  "documents": [
    {
      "case_id": null,
      "contract_id": "simulation.adapter_protocol.manifest",
      "digest": "sha256:0deda3a707afcbad7419d469dec7eb416c8d7178a9efcf9622bb1ada62482a93",
      "expected_failure_code": null,
      "kind": "adapter_manifest",
      "owner": "simulation-skills",
      "relative_path": "adapter-manifest.json",
      "schema_ref": "https://simulation-copilot-workbench.local/schemas/v0.1/adapter-manifest.schema.json",
      "schema_version": "0.1.0",
      "validation_layer": null,
      "validity": "valid"
    },
    {
      "case_id": "equipment-maintenance",
      "contract_id": "simulation.conformance_case",
      "digest": "sha256:3b16cef2f92b606d0667140b460ab04bf9a4046bcfddc734814b73c5179e45e2",
      "expected_failure_code": null,
      "kind": "case",
      "owner": "simulation-skills",
      "relative_path": "cases/equipment-maintenance/case.json",
      "schema_ref": "schemas/conformance-case.schema.json",
      "schema_version": "0.1.0",
      "validation_layer": null,
      "validity": "valid"
    },
    {
      "case_id": "traffic-intersection",
      "contract_id": "simulation.conformance_case",
      "digest": "sha256:85f824db8ef2ab3f263d4350b011c032d2d385d85b1afefde165b1333382bbe0",
      "expected_failure_code": null,
      "kind": "case",
      "owner": "simulation-skills",
      "relative_path": "cases/traffic-intersection/case.json",
      "schema_ref": "schemas/conformance-case.schema.json",
      "schema_version": "0.1.0",
      "validation_layer": null,
      "validity": "valid"
    },
    {
      "case_id": "warehouse-queueing",
      "contract_id": "simulation.conformance_case",
      "digest": "sha256:8aebfa38d175a40b230e4af58bad1c9dc006225a9a5cc02e56cda6f2428ddf3a",
      "expected_failure_code": null,
      "kind": "case",
      "owner": "simulation-skills",
      "relative_path": "cases/warehouse-queueing/case.json",
      "schema_ref": "schemas/conformance-case.schema.json",
      "schema_version": "0.1.0",
      "validation_layer": null,
      "validity": "valid"
    },
    {
      "case_id": null,
      "contract_id": "simulation.model_spec",
      "digest": "sha256:d6bd57401c8ae74f4c409615213b49887fc7c05549705303a0250d50c8cc9914",
      "expected_failure_code": "schema_contract_failed",
      "kind": "fixture",
      "owner": "simulation-skills",
      "relative_path": "fixtures/invalid/missing-provenance.json",
      "schema_ref": "schemas/model-spec.schema.json",
      "schema_version": "0.1.0",
      "validation_layer": "schema",
      "validity": "invalid"
    },
    {
      "case_id": null,
      "contract_id": "simulation.model_spec",
      "digest": "sha256:553c35607f2d430bd79497996ff0412ed153985b4c9b6e6bb7e8ae3035554a16",
      "expected_failure_code": "schema_contract_failed",
      "kind": "fixture",
      "owner": "simulation-skills",
      "relative_path": "fixtures/invalid/missing-units.json",
      "schema_ref": "schemas/model-spec.schema.json",
      "schema_version": "0.1.0",
      "validation_layer": "schema",
      "validity": "invalid"
    },
    {
      "case_id": null,
      "contract_id": "simulation.conformance_case",
      "digest": "sha256:5fa0de42731938ea7d67ea1a7da379b251413cb4f5069d3e118406fba09af022",
      "expected_failure_code": "domain_pack_manifest_digest_mismatch",
      "kind": "fixture",
      "owner": "simulation-skills",
      "relative_path": "fixtures/invalid/stale-digest.json",
      "schema_ref": "schemas/conformance-case.schema.json",
      "schema_version": "0.1.0",
      "validation_layer": "semantic",
      "validity": "invalid"
    },
    {
      "case_id": null,
      "contract_id": "simulation.model_spec",
      "digest": "sha256:aa6e5aa0dfbd6ba76d3f658c5fbe695b36be01538294860481a77c261f719fe0",
      "expected_failure_code": "schema_contract_failed",
      "kind": "fixture",
      "owner": "simulation-skills",
      "relative_path": "fixtures/invalid/unknown-major.json",
      "schema_ref": "schemas/model-spec.schema.json",
      "schema_version": "0.1.0",
      "validation_layer": "schema",
      "validity": "invalid"
    },
    {
      "case_id": null,
      "contract_id": "simulation.model_spec",
      "digest": "sha256:9d1a4fb080f2a324230d505e2abb44de459c558129502ac3d289deb52aab2f30",
      "expected_failure_code": "unknown_required_extension",
      "kind": "fixture",
      "owner": "simulation-skills",
      "relative_path": "fixtures/invalid/unknown-required-extension.json",
      "schema_ref": "schemas/model-spec.schema.json",
      "schema_version": "0.1.0",
      "validation_layer": "semantic",
      "validity": "invalid"
    },
    {
      "case_id": null,
      "contract_id": "simulation.conformance_case",
      "digest": "sha256:114ec94bba63759685e57a5b13e1fb4e7c7668fd7fafdfb2d2afa81b73cb97cc",
      "expected_failure_code": "domain_pack_manifest_digest_mismatch",
      "kind": "fixture",
      "owner": "simulation-skills",
      "relative_path": "fixtures/invalid/wrong-digest.json",
      "schema_ref": "schemas/conformance-case.schema.json",
      "schema_version": "0.1.0",
      "validation_layer": "semantic",
      "validity": "invalid"
    },
    {
      "case_id": null,
      "contract_id": "simulation.model_spec",
      "digest": "sha256:ff59e0add9e75d5446a96afad19fa9a337eb180ca3824fd02c8cf908fb5afd6b",
      "expected_failure_code": "schema_contract_failed",
      "kind": "fixture",
      "owner": "simulation-skills",
      "relative_path": "fixtures/invalid/wrong-revision.json",
      "schema_ref": "schemas/model-spec.schema.json",
      "schema_version": "0.1.0",
      "validation_layer": "schema",
      "validity": "invalid"
    },
    {
      "case_id": null,
      "contract_id": "simulation.des_method_payload",
      "digest": "sha256:640a0acda22b1839ce93dc96248c379b73f71b42ecc37c607f828315693208d7",
      "expected_failure_code": null,
      "kind": "fixture",
      "owner": "simulation-skills",
      "relative_path": "fixtures/valid/des-method-payload.json",
      "schema_ref": "schemas/des-method-payload.schema.json",
      "schema_version": "0.1.0",
      "validation_layer": null,
      "validity": "valid"
    },
    {
      "case_id": null,
      "contract_id": "simulation.domain_pack",
      "digest": "sha256:f9ee6637e91d7cd770b2f788b4e13f4b4b19760cfbffceb1a78e8f89db570368",
      "expected_failure_code": null,
      "kind": "fixture",
      "owner": "simulation-skills",
      "relative_path": "fixtures/valid/domain-pack.json",
      "schema_ref": "schemas/domain-pack.schema.json",
      "schema_version": "0.1.0",
      "validation_layer": null,
      "validity": "valid"
    },
    {
      "case_id": null,
      "contract_id": "simulation.model_spec",
      "digest": "sha256:56fe9d413b1499d268da329514f2664b069741fa62158c0e3c65e00ae10f778b",
      "expected_failure_code": null,
      "kind": "fixture",
      "owner": "simulation-skills",
      "relative_path": "fixtures/valid/model-spec.json",
      "schema_ref": "schemas/model-spec.schema.json",
      "schema_version": "0.1.0",
      "validation_layer": null,
      "validity": "valid"
    },
    {
      "case_id": null,
      "contract_id": "simulation.result_set",
      "digest": "sha256:b1c7c56479aa6b3fbf282949b4df14314b7ba9ea142b0f154f8df2273d8d391c",
      "expected_failure_code": null,
      "kind": "fixture",
      "owner": "simulation-skills",
      "relative_path": "fixtures/valid/result-set.json",
      "schema_ref": "schemas/result-set.schema.json",
      "schema_version": "0.1.0",
      "validation_layer": null,
      "validity": "valid"
    },
    {
      "case_id": null,
      "contract_id": "simulation.abm_method_payload",
      "digest": "sha256:fb6e99e198f1c748d20b7aa5c98f867e3487f55754efeed50dfaa409b71b693e",
      "expected_failure_code": null,
      "kind": "schema",
      "owner": "simulation-skills",
      "relative_path": "schemas/abm-method-payload.schema.json",
      "schema_ref": null,
      "schema_version": "0.1.0",
      "validation_layer": null,
      "validity": null
    },
    {
      "case_id": null,
      "contract_id": "simulation.contract_common",
      "digest": "sha256:c0be8a1f2a149f88e2a09a9cb12e4112ca89d147a9291ab593dee6d9415a4175",
      "expected_failure_code": null,
      "kind": "schema",
      "owner": "simulation-skills",
      "relative_path": "schemas/common.schema.json",
      "schema_ref": null,
      "schema_version": "0.1.0",
      "validation_layer": null,
      "validity": null
    },
    {
      "case_id": null,
      "contract_id": "simulation.conformance_case",
      "digest": "sha256:cb7c112192c8ed96f0d598f2c12d9b79fbcba800442a2369c60d53589390ff6a",
      "expected_failure_code": null,
      "kind": "schema",
      "owner": "simulation-skills",
      "relative_path": "schemas/conformance-case.schema.json",
      "schema_ref": null,
      "schema_version": "0.1.0",
      "validation_layer": null,
      "validity": null
    },
    {
      "case_id": null,
      "contract_id": "simulation.conformance_export",
      "digest": "sha256:7ec37b67351818da9a5872d7c43ed66224fa011a2f63cacb1b148db4df54ed31",
      "expected_failure_code": null,
      "kind": "schema",
      "owner": "simulation-skills",
      "relative_path": "schemas/conformance-export.schema.json",
      "schema_ref": null,
      "schema_version": "0.1.0",
      "validation_layer": null,
      "validity": null
    },
    {
      "case_id": null,
      "contract_id": "simulation.des_method_payload",
      "digest": "sha256:feaa917e9f387eaf062de916b823357cef241bef72982f55dd9a1bfab2986f1d",
      "expected_failure_code": null,
      "kind": "schema",
      "owner": "simulation-skills",
      "relative_path": "schemas/des-method-payload.schema.json",
      "schema_ref": null,
      "schema_version": "0.1.0",
      "validation_layer": null,
      "validity": null
    },
    {